{"command": "parse", "elements": [{"bbox": {"height": 32, "width": 492, "x": 105, "y": 96}, "confidence": 0.986254, "element_id": "e_0db25b4d6de100e7", "element_type": "text", "index": 0, "interactable": false, "label": "Ready: Large Injection x Disarm"}, {"bbox": {"height": 19, "width": 85, "x": 1031, "y": 159}, "confidence": 0.992895, "element_id": "e_b53e5c16e959539d", "element_type": "text", "index": 1, "interactable": false, "label": "Rise Time"}, {"bbox": {"height": 34, "width": 72, "x": 1028, "y": 186}, "confidence": 0.998313, "element_id": "e_0039ae2fb750af49", "element_type": "text", "index": 2, "interactable": false, "label": "0.5s"}, {"bbox": {"height": 19, "width": 113, "x": 1031, "y": 247}, "confidence": 0.955973, "element_id": "e_c177e9032cba0d50", "element_type": "text", "index": 3, "interactable": false, "label": "Last Injection."}, {"bbox": {"height": 32, "width": 58, "x": 1029, "y": 275}, "confidence": 0.99836, "element_id": "e_da9d4afa215608c9", "element_type": "text", "index": 4, "interactable": false, "label": "9.5"}, {"bbox": {"height": 33, "width": 81, "x": 1144, "y": 274}, "confidence": 0.9996, "element_id": "e_87ef3ca480209a1d", "element_type": "text", "index": 5, "interactable": false, "label": "18.5"}, {"bbox": {"height": 18, "width": 40, "x": 1027, "y": 329}, "confidence": 0.995542, "element_id": "e_dbc038a7a1bc5a5c", "element_type": "text", "index": 6, "interactable": false, "label": "mL/s"}, {"bbox": {"height": 17, "width": 24, "x": 1144, "y": 330}, "confidence": 0.990123, "element_id": "e_0166f2840d634fc2", "element_type": "text", "index": 7, "interactable": false, "label": "mL"}, {"bbox": {"height": 23, "width": 98, "x": 1028, "y": 373}, "confidence": 0.992733, "element_id": "e_cb18bf1ea08650d2", "element_type": "text", "index": 8, "interactable": false, "label": "X-ray Sync"}, {"bbox": {"height": 16, "width": 28, "x": 1159, "y": 376}, "confidence": 0.996362, "element_id": "e_5839426cf18dd47f", "element_type": "text", "index": 9, "interactable": false, "label": "OFF"}, {"bbox": {"height": 42, "width": 65, "x": 104, "y": 488}, "confidence": 0.999259, "element_id": "e_8c2e6d1f7c9f47b7", "element_type": "text", "index": 10, "interactable": false, "label": "43"}, {"bbox": {"height": 46, "width": 76, "x": 660, "y": 487}, "confidence": 0.920891, "element_id": "e_d66e3a0ddb16f50b", "element_type": "text", "index": 11, "interactable": false, "label": "80."}, {"bbox": {"height": 16, "width": 23, "x": 172, "y": 512}, "confidence": 0.971337, "element_id": "e_ad2b980831d94640", "element_type": "text", "index": 12, "interactable": false, "label": "mL"}, {"bbox": {"height": 20, "width": 161, "x": 207, "y": 510}, "confidence": 0.974775, "element_id": "e_32dca882d8bfa19b", "element_type": "text", "index": 13, "interactable": false, "label": "Contrast to Patient."}, {"bbox": {"height": 17, "width": 154, "x": 1031, "y": 503}, "confidence": 0.968403, "element_id": "e_565936294f90ee7f", "element_type": "text", "index": 14, "interactable": false, "label": "Contrast Available."}, {"bbox": {"height": 33, "width": 84, "x": 449, "y": 608}, "confidence": 0.999859, "element_id": "e_74dbe4b5776e299e", "element_type": "text", "index": 15, "interactable": false, "label": "51%"}, {"bbox": {"height": 17, "width": 127, "x": 1128, "y": 607}, "confidence": 0.927112, "element_id": "e_f8c89a9ec221de83", "element_type": "text", "index": 16, "interactable": false, "label": "Auto refill at 30 mL."}, {"bbox": {"height": 57, "width": 229, "x": 1028, "y": 537}, "confidence": 0.90105, "element_id": "e_62f470aa9be56a33", "element_type": "icon", "index": 17, "interactable": true, "label": "95 mL"}, {"bbox": {"height": 49, "width": 111, "x": 1146, "y": 636}, "confidence": 0.887501, "element_id": "e_a246b38fb3dc5c64", "element_type": "icon", "index": 18, "interactable": true, "label": "REFILL"}, {"bbox": {"height": 48, "width": 108, "x": 1030, "y": 636}, "confidence": 0.857204, "element_id": "e_3ea1b9bcf88fce43", "element_type": "icon", "index": 19, "interactable": true, "label": "PURGE"}, {"bbox": {"height": 30, "width": 134, "x": 103, "y": 654}, "confidence": 0.787166, "element_id": "e_564330b59cbd96a1", "element_type": "icon", "index": 20, "interactable": true, "label": "Dr. Johnson"}, {"bbox": {"height": 299, "width": 415, "x": 573, "y": 158}, "confidence": 0.372123, "element_id": "e_f66b0fdb308ffae7", "element_type": "icon", "index": 21, "interactable": true, "label": "Volume (mL) 21.0"}, {"bbox": {"height": 28, "width": 132, "x": 1126, "y": 18}, "confidence": 0.312527, "element_id": "e_3260bba0f74f72e0", "element_type": "icon", "index": 22, "interactable": true, "label": "ACIST Pro'"}, {"bbox": {"height": 33, "width": 107, "x": 392, "y": 16}, "confidence": 0.218429, "element_id": "e_4e94b174cdcf56bc", "element_type": "icon", "index": 23, "interactable": true, "label": "LV/Aorta"}, {"bbox": {"height": 293, "width": 415, "x": 118, "y": 164}, "confidence": 0.209877, "element_id": "e_1303f88df72a4bb4", "element_type": "icon", "index": 24, "interactable": true, "label": "Flow Rate (mL/s) 11.0"}, {"bbox": {"height": 68, "width": 129, "x": 77, "y": 0}, "confidence": 0.186415, "element_id": "e_7c800068e549dcf7", "element_type": "icon", "index": 25, "interactable": true, "label": "Cardiac v"}, {"bbox": {"height": 64, "width": 49, "x": 232, "y": 1}, "confidence": 0.135974, "element_id": "e_2e8965024ab7c9aa", "element_type": "icon", "index": 26, "interactable": true, "label": "LCA"}, {"bbox": {"height": 33, "width": 53, "x": 311, "y": 15}, "confidence": 0.098785, "element_id": "e_6201e44f63c195d4", "element_type": "icon", "index": 27, "interactable": true, "label": "RCA"}, {"bbox": {"height": 28, "width": 104, "x": 762, "y": 506}, "confidence": 0.067091, "element_id": "e_7042e46bc5a8b3ed", "element_type": "icon", "index": 28, "interactable": true, "label": "Target Limit"}, {"bbox": {"height": 29, "width": 59, "x": 1197, "y": 369}, "confidence": 0.872397, "element_id": "e_6dc10bd9a0aa0d83", "element_type": "icon", "index": 29, "interactable": true, "label": "A single oval shape."}, {"bbox": {"height": 46, "width": 46, "x": 16, "y": 11}, "confidence": 0.408891, "element_id": "e_67dd5154a60b6035", "element_type": "icon", "index": 30, "interactable": true, "label": "a horizontal bar or horizontal line."}, {"bbox": {"height": 53, "width": 46, "x": 17, "y": 725}, "confidence": 0.342132, "element_id": "e_f8ab90f3c00edac6", "element_type": "icon", "index": 31, "interactable": true, "label": "A simple motion blur or moving back or forth."}, {"bbox": {"height": 37, "width": 28, "x": 26, "y": 327}, "confidence": 0.299797, "element_id": "e_0b319518e6b50f15", "element_type": "icon", "index": 32, "interactable": true, "label": "A horizontal bar or horizontal line."}, {"bbox": {"height": 38, "width": 34, "x": 24, "y": 250}, "confidence": 0.132022, "element_id": "e_5b02ce6037edb7b9", "element_type": "icon", "index": 33, "interactable": true, "label": "A simple running or running application."}, {"bbox": {"height": 32, "width": 32, "x": 25, "y": 101}, "confidence": 0.100426, "element_id": "e_45257347fddc5d13", "element_type": "icon", "index": 34, "interactable": true, "label": "A simple icon or logo."}, {"bbox": {"height": 66, "width": 55, "x": 12, "y": 162}, "confidence": 0.096006, "element_id": "e_91ebb9bf12723ab4", "element_type": "icon", "index": 35, "interactable": true, "label": "A simple design or logo."}], "error": null, "image_height": 800, "image_width": 1280, "meta": {"box_threshold": 0.05, "cache_hit": true, "cli_version": "1.0.0", "command": "parse", "config_path": null, "config_sha256": null, "device": "cpu", "engine": "omniparser", "image_height": 800, "image_path": "/home/wavy/ai/caliper-ui/cli-debug-inputs/acist-1280x800-playwright.png", "image_sha256": "8390d7f9e60f11a45013f9e50675eb3d0688cc82554be3a46589925f3ed688be", "image_width": 1280, "omniparser_version": "b0d5c9f-dirty", "processing_time_ms": 5, "request_id": "0549c236c95f45249842f464691063b0", "timestamp_utc": "2026-03-22T23:12:26Z", "uied_root": null, "uied_text_engine": null}, "request_id": "0549c236c95f45249842f464691063b0", "schema_version": "1.1", "status": "success", "timestamp_utc": "2026-03-22T23:12:26Z", "warnings": []}
